docs/samples/solution_map/gfx906_rocfft_solution_map.dat
[
{"Problem":{"arch":"gfx906","token":"kernel_len81_SP_sbcc_NONE"},
  "Solutions":[ {"sol_node_type":"SOL_KERNEL_ONLY","kernel_key":{"lengths":[ 81,0 ],"precision":"single","scheme":"CS_KERNEL_STOCKHAM_BLOCK_CC","sbrc_trans":"NONE","kernelConfig":{"use_3steps":false,"half_lds":true,"dir_reg":true,"tpb":28,"wgs":252,"tpt":[ 9,0 ],"factors":[ 9,3,3 ]}}}
               ,{"sol_node_type":"SOL_KERNEL_ONLY","kernel_key":{"lengths":[ 81,0 ],"precision":"single","scheme":"CS_KERNEL_STOCKHAM_BLOCK_CC","sbrc_trans":"NONE","kernelConfig":{"use_3steps":false,"half_lds":false,"dir_reg":true,"tpb":42,"wgs":378,"tpt":[ 9,0 ],"factors":[ 9,3,3 ]}}}
                ]}
,{"Problem":{"arch":"gfx906","token":"kernel_len81_SP_sbrr_NONE"},
  "Solutions":[ {"sol_node_type":"SOL_KERNEL_ONLY","kernel_key":{"lengths":[ 81,0 ],"precision":"single","scheme":"CS_KERNEL_STOCKHAM","sbrc_trans":"NONE","kernelConfig":{"use_3steps":false,"half_lds":true,"dir_reg":true,"tpb":15,"wgs":135,"tpt":[ 9,0 ],"factors":[ 9,3,3 ]}}}
                ]}

,{"Problem":{"arch":"gfx906","token":"81_sp_ip_complex"},
  "Solutions":[ {"sol_node_type":"SOL_LEAF_NODE","using_scheme":"CS_KERNEL_STOCKHAM","solution_childnodes":[ {"child_token":"kernel_len81_SP_sbrr_NONE","child_option":0} ]}
                ]}
,{"Problem":{"arch":"gfx906","token":"sbcc_81_sp_ip_complex"},
  "Solutions":[ {"sol_node_type":"SOL_LEAF_NODE","using_scheme":"CS_KERNEL_STOCKHAM_BLOCK_CC","solution_childnodes":[ {"child_token":"kernel_len81_SP_sbcc_NONE","child_option":0} ]}
               ,{"sol_node_type":"SOL_LEAF_NODE","using_scheme":"CS_KERNEL_STOCKHAM_BLOCK_CC","solution_childnodes":[ {"child_token":"kernel_len81_SP_sbcc_NONE","child_option":1} ]}
                ]}

,{"Problem":{"arch":"gfx906","token":"81_81_sp_ip_complex"},
  "Solutions":[ {"sol_node_type":"SOL_INTERNAL_NODE","using_scheme":"CS_2D_RC","solution_childnodes":[ {"child_token":"81_sp_ip_complex","child_option":0},{"child_token":"sbcc_81_sp_ip_complex","child_option":0} ]}
                ]}
,{"Problem":{"arch":"gfx906","token":"81_81_81_sp_ip_complex"},
  "Solutions":[ {"sol_node_type":"SOL_INTERNAL_NODE","using_scheme":"CS_3D_RC","solution_childnodes":[ {"child_token":"81_81_sp_ip_complex","child_option":0},{"child_token":"sbcc_81_sp_ip_complex","child_option":1} ]}
                ]}
]