solution_map/gfx90a_rocfft_solution_map.dat
[
{"Problem":{"arch":"gfx90a","token":"kernel_token_builtin_kernel"},
  "Solutions":[ {"sol_node_type":"SOL_BUILTIN_KERNEL"}
                ]}
,{"Problem":{"arch":"gfx90a","token":"kernel_len125_single_sbrr"},
  "Solutions":[ {"sol_node_type":"SOL_KERNEL_ONLY","kernel_key":{"lengths":[ 125,0 ],"precision":"single","scheme":"CS_KERNEL_STOCKHAM","sbrc_trans":"NONE","kernelConfig":{"use_3steps":false,"half_lds":true,"dir_reg":true,"buffer_inst":false,"tpb":10,"wgs":250,"tpt":[ 25,0 ],"factors":[ 5,5,5 ]}}}
               ,{"sol_node_type":"SOL_KERNEL_ONLY","kernel_key":{"lengths":[ 125,0 ],"precision":"single","scheme":"CS_KERNEL_STOCKHAM","sbrc_trans":"NONE","kernelConfig":{"use_3steps":false,"half_lds":false,"dir_reg":true,"buffer_inst":false,"tpb":10,"wgs":250,"tpt":[ 25,0 ],"factors":[ 5,5,5 ]}}}
                ]}
,{"Problem":{"arch":"gfx90a","token":"kernel_len2187_single_sbrr"},
  "Solutions":[ {"sol_node_type":"SOL_KERNEL_ONLY","kernel_key":{"lengths":[ 2187,0 ],"precision":"single","scheme":"CS_KERNEL_STOCKHAM","sbrc_trans":"NONE","kernelConfig":{"use_3steps":false,"half_lds":false,"dir_reg":true,"buffer_inst":false,"tpb":1,"wgs":243,"tpt":[ 243,0 ],"factors":[ 9,9,9,3 ]}}}
                ]}
,{"Problem":{"arch":"gfx90a","token":"kernel_len243_single_sbrr"},
  "Solutions":[ {"sol_node_type":"SOL_KERNEL_ONLY","kernel_key":{"lengths":[ 243,0 ],"precision":"single","scheme":"CS_KERNEL_STOCKHAM","sbrc_trans":"NONE","kernelConfig":{"use_3steps":false,"half_lds":false,"dir_reg":false,"buffer_inst":false,"tpb":4,"wgs":108,"tpt":[ 27,0 ],"factors":[ 9,9,3 ]}}}
               ,{"sol_node_type":"SOL_KERNEL_ONLY","kernel_key":{"lengths":[ 243,0 ],"precision":"single","scheme":"CS_KERNEL_STOCKHAM","sbrc_trans":"NONE","kernelConfig":{"use_3steps":false,"half_lds":false,"dir_reg":true,"buffer_inst":false,"tpb":7,"wgs":189,"tpt":[ 27,0 ],"factors":[ 9,9,3 ]}}}
                ]}
,{"Problem":{"arch":"gfx90a","token":"kernel_len256_single_sbrr"},
  "Solutions":[ {"sol_node_type":"SOL_KERNEL_ONLY","kernel_key":{"lengths":[ 256,0 ],"precision":"single","scheme":"CS_KERNEL_STOCKHAM","sbrc_trans":"NONE","kernelConfig":{"use_3steps":false,"half_lds":false,"dir_reg":true,"buffer_inst":false,"tpb":4,"wgs":128,"tpt":[ 32,0 ],"factors":[ 2,4,4,8 ]}}}
                ]}
,{"Problem":{"arch":"gfx90a","token":"kernel_len4096_single_sbrr"},
  "Solutions":[ {"sol_node_type":"SOL_KERNEL_ONLY","kernel_key":{"lengths":[ 4096,0 ],"precision":"single","scheme":"CS_KERNEL_STOCKHAM","sbrc_trans":"NONE","kernelConfig":{"use_3steps":false,"half_lds":true,"dir_reg":true,"buffer_inst":false,"tpb":2,"wgs":256,"tpt":[ 128,0 ],"factors":[ 8,16,4,8 ]}}}
                ]}
,{"Problem":{"arch":"gfx90a","token":"kernel_len56_double_sbrr"},
  "Solutions":[ {"sol_node_type":"SOL_KERNEL_ONLY","kernel_key":{"lengths":[ 56,0 ],"precision":"double","scheme":"CS_KERNEL_STOCKHAM","sbrc_trans":"NONE","kernelConfig":{"use_3steps":false,"half_lds":false,"dir_reg":true,"buffer_inst":false,"tpb":16,"wgs":128,"tpt":[ 8,0 ],"factors":[ 7,4,2 ]}}}
               ,{"sol_node_type":"SOL_KERNEL_ONLY","kernel_key":{"lengths":[ 56,0 ],"precision":"double","scheme":"CS_KERNEL_STOCKHAM","sbrc_trans":"NONE","kernelConfig":{"use_3steps":false,"half_lds":false,"dir_reg":true,"buffer_inst":false,"tpb":8,"wgs":64,"tpt":[ 8,0 ],"factors":[ 7,4,2 ]}}}
               ,{"sol_node_type":"SOL_KERNEL_ONLY","kernel_key":{"lengths":[ 56,0 ],"precision":"double","scheme":"CS_KERNEL_STOCKHAM","sbrc_trans":"NONE","kernelConfig":{"use_3steps":false,"half_lds":false,"dir_reg":true,"buffer_inst":false,"tpb":24,"wgs":192,"tpt":[ 8,0 ],"factors":[ 7,2,4 ]}}}
                ]}
,{"Problem":{"arch":"gfx90a","token":"kernel_len81_double_sbrr"},
  "Solutions":[ {"sol_node_type":"SOL_KERNEL_ONLY","kernel_key":{"lengths":[ 81,0 ],"precision":"double","scheme":"CS_KERNEL_STOCKHAM","sbrc_trans":"NONE","kernelConfig":{"use_3steps":false,"half_lds":false,"dir_reg":true,"buffer_inst":false,"tpb":21,"wgs":189,"tpt":[ 9,0 ],"factors":[ 9,3,3 ]}}}
                ]}
,{"Problem":{"arch":"gfx90a","token":"kernel_len100_double_sbcc"},
  "Solutions":[ {"sol_node_type":"SOL_KERNEL_ONLY","kernel_key":{"lengths":[ 100,0 ],"precision":"double","scheme":"CS_KERNEL_STOCKHAM_BLOCK_CC","sbrc_trans":"NONE","kernelConfig":{"use_3steps":true,"half_lds":true,"dir_reg":true,"buffer_inst":false,"tpb":12,"wgs":120,"tpt":[ 10,0 ],"factors":[ 10,2,5 ]}}}
                ]}
,{"Problem":{"arch":"gfx90a","token":"kernel_len125_double_sbcc"},
  "Solutions":[ {"sol_node_type":"SOL_KERNEL_ONLY","kernel_key":{"lengths":[ 125,0 ],"precision":"double","scheme":"CS_KERNEL_STOCKHAM_BLOCK_CC","sbrc_trans":"NONE","kernelConfig":{"use_3steps":true,"half_lds":false,"dir_reg":true,"buffer_inst":true,"tpb":9,"wgs":225,"tpt":[ 25,0 ],"factors":[ 5,5,5 ]}}}
               ,{"sol_node_type":"SOL_KERNEL_ONLY","kernel_key":{"lengths":[ 125,0 ],"precision":"double","scheme":"CS_KERNEL_STOCKHAM_BLOCK_CC","sbrc_trans":"NONE","kernelConfig":{"use_3steps":true,"half_lds":false,"dir_reg":true,"buffer_inst":true,"tpb":10,"wgs":250,"tpt":[ 25,0 ],"factors":[ 5,5,5 ]}}}
                ]}
,{"Problem":{"arch":"gfx90a","token":"kernel_len125_single_sbcc"},
  "Solutions":[ {"sol_node_type":"SOL_KERNEL_ONLY","kernel_key":{"lengths":[ 125,0 ],"precision":"single","scheme":"CS_KERNEL_STOCKHAM_BLOCK_CC","sbrc_trans":"NONE","kernelConfig":{"use_3steps":false,"half_lds":false,"dir_reg":true,"buffer_inst":true,"tpb":32,"wgs":160,"tpt":[ 5,0 ],"factors":[ 5,5,5 ]}}}
               ,{"sol_node_type":"SOL_KERNEL_ONLY","kernel_key":{"lengths":[ 125,0 ],"precision":"single","scheme":"CS_KERNEL_STOCKHAM_BLOCK_CC","sbrc_trans":"NONE","kernelConfig":{"use_3steps":false,"half_lds":false,"dir_reg":true,"buffer_inst":true,"tpb":20,"wgs":500,"tpt":[ 25,0 ],"factors":[ 5,5,5 ]}}}
               ,{"sol_node_type":"SOL_KERNEL_ONLY","kernel_key":{"lengths":[ 125,0 ],"precision":"single","scheme":"CS_KERNEL_STOCKHAM_BLOCK_CC","sbrc_trans":"NONE","kernelConfig":{"use_3steps":false,"half_lds":false,"dir_reg":true,"buffer_inst":false,"tpb":20,"wgs":500,"tpt":[ 25,0 ],"factors":[ 5,5,5 ]}}}
                ]}
,{"Problem":{"arch":"gfx90a","token":"kernel_len168_double_sbcc"},
  "Solutions":[ {"sol_node_type":"SOL_KERNEL_ONLY","kernel_key":{"lengths":[ 168,0 ],"precision":"double","scheme":"CS_KERNEL_STOCKHAM_BLOCK_CC","sbrc_trans":"NONE","kernelConfig":{"use_3steps":true,"half_lds":true,"dir_reg":true,"buffer_inst":true,"tpb":12,"wgs":252,"tpt":[ 21,0 ],"factors":[ 7,8,3 ]}}}
               ,{"sol_node_type":"SOL_KERNEL_ONLY","kernel_key":{"lengths":[ 168,0 ],"precision":"double","scheme":"CS_KERNEL_STOCKHAM_BLOCK_CC","sbrc_trans":"NONE","kernelConfig":{"use_3steps":true,"half_lds":true,"dir_reg":true,"buffer_inst":true,"tpb":12,"wgs":168,"tpt":[ 14,0 ],"factors":[ 7,6,2,2 ]}}}
               ,{"sol_node_type":"SOL_KERNEL_ONLY","kernel_key":{"lengths":[ 168,0 ],"precision":"double","scheme":"CS_KERNEL_STOCKHAM_BLOCK_CC","sbrc_trans":"NONE","kernelConfig":{"use_3steps":true,"half_lds":true,"dir_reg":true,"buffer_inst":true,"tpb":12,"wgs":168,"tpt":[ 14,0 ],"factors":[ 2,7,6,2 ]}}}
                ]}
,{"Problem":{"arch":"gfx90a","token":"kernel_len224_double_sbcc"},
  "Solutions":[ {"sol_node_type":"SOL_KERNEL_ONLY","kernel_key":{"lengths":[ 224,0 ],"precision":"double","scheme":"CS_KERNEL_STOCKHAM_BLOCK_CC","sbrc_trans":"NONE","kernelConfig":{"use_3steps":false,"half_lds":false,"dir_reg":true,"buffer_inst":false,"tpb":9,"wgs":252,"tpt":[ 28,0 ],"factors":[ 7,2,4,4 ]}}}
                ]}
,{"Problem":{"arch":"gfx90a","token":"kernel_len243_double_sbcc"},
  "Solutions":[ {"sol_node_type":"SOL_KERNEL_ONLY","kernel_key":{"lengths":[ 243,0 ],"precision":"double","scheme":"CS_KERNEL_STOCKHAM_BLOCK_CC","sbrc_trans":"NONE","kernelConfig":{"use_3steps":true,"half_lds":false,"dir_reg":true,"buffer_inst":false,"tpb":7,"wgs":189,"tpt":[ 27,0 ],"factors":[ 3,9,3,3 ]}}}
               ,{"sol_node_type":"SOL_KERNEL_ONLY","kernel_key":{"lengths":[ 243,0 ],"precision":"double","scheme":"CS_KERNEL_STOCKHAM_BLOCK_CC","sbrc_trans":"NONE","kernelConfig":{"use_3steps":true,"half_lds":false,"dir_reg":true,"buffer_inst":false,"tpb":7,"wgs":189,"tpt":[ 27,0 ],"factors":[ 9,3,3,3 ]}}}
               ,{"sol_node_type":"SOL_KERNEL_ONLY","kernel_key":{"lengths":[ 243,0 ],"precision":"double","scheme":"CS_KERNEL_STOCKHAM_BLOCK_CC","sbrc_trans":"NONE","kernelConfig":{"use_3steps":false,"half_lds":false,"dir_reg":true,"buffer_inst":false,"tpb":8,"wgs":216,"tpt":[ 27,0 ],"factors":[ 9,9,3 ]}}}
                ]}
,{"Problem":{"arch":"gfx90a","token":"kernel_len243_single_sbcc"},
  "Solutions":[ {"sol_node_type":"SOL_KERNEL_ONLY","kernel_key":{"lengths":[ 243,0 ],"precision":"single","scheme":"CS_KERNEL_STOCKHAM_BLOCK_CC","sbrc_trans":"NONE","kernelConfig":{"use_3steps":false,"half_lds":false,"dir_reg":true,"buffer_inst":false,"tpb":16,"wgs":432,"tpt":[ 27,0 ],"factors":[ 3,3,9,3 ]}}}
                ]}
,{"Problem":{"arch":"gfx90a","token":"kernel_len336_double_sbcc"},
  "Solutions":[ {"sol_node_type":"SOL_KERNEL_ONLY","kernel_key":{"lengths":[ 336,0 ],"precision":"double","scheme":"CS_KERNEL_STOCKHAM_BLOCK_CC","sbrc_trans":"NONE","kernelConfig":{"use_3steps":false,"half_lds":false,"dir_reg":true,"buffer_inst":false,"tpb":6,"wgs":168,"tpt":[ 28,0 ],"factors":[ 4,7,3,4 ]}}}
               ,{"sol_node_type":"SOL_KERNEL_ONLY","kernel_key":{"lengths":[ 336,0 ],"precision":"double","scheme":"CS_KERNEL_STOCKHAM_BLOCK_CC","sbrc_trans":"NONE","kernelConfig":{"use_3steps":false,"half_lds":true,"dir_reg":true,"buffer_inst":false,"tpb":6,"wgs":126,"tpt":[ 21,0 ],"factors":[ 7,8,2,3 ]}}}
               ,{"sol_node_type":"SOL_KERNEL_ONLY","kernel_key":{"lengths":[ 336,0 ],"precision":"double","scheme":"CS_KERNEL_STOCKHAM_BLOCK_CC","sbrc_trans":"NONE","kernelConfig":{"use_3steps":false,"half_lds":false,"dir_reg":true,"buffer_inst":true,"tpb":4,"wgs":112,"tpt":[ 28,0 ],"factors":[ 2,7,6,4 ]}}}
               ,{"sol_node_type":"SOL_KERNEL_ONLY","kernel_key":{"lengths":[ 336,0 ],"precision":"double","scheme":"CS_KERNEL_STOCKHAM_BLOCK_CC","sbrc_trans":"NONE","kernelConfig":{"use_3steps":false,"half_lds":true,"dir_reg":true,"buffer_inst":false,"tpb":6,"wgs":252,"tpt":[ 42,0 ],"factors":[ 3,7,8,2 ]}}}
               ,{"sol_node_type":"SOL_KERNEL_ONLY","kernel_key":{"lengths":[ 336,0 ],"precision":"double","scheme":"CS_KERNEL_STOCKHAM_BLOCK_CC","sbrc_trans":"NONE","kernelConfig":{"use_3steps":false,"half_lds":false,"dir_reg":true,"buffer_inst":false,"tpb":6,"wgs":168,"tpt":[ 28,0 ],"factors":[ 7,3,4,4 ]}}}
                ]}
,{"Problem":{"arch":"gfx90a","token":"kernel_len343_double_sbcc"},
  "Solutions":[ {"sol_node_type":"SOL_KERNEL_ONLY","kernel_key":{"lengths":[ 343,0 ],"precision":"double","scheme":"CS_KERNEL_STOCKHAM_BLOCK_CC","sbrc_trans":"NONE","kernelConfig":{"use_3steps":true,"half_lds":false,"dir_reg":true,"buffer_inst":true,"tpb":4,"wgs":196,"tpt":[ 49,0 ],"factors":[ 7,7,7 ]}}}
                ]}
,{"Problem":{"arch":"gfx90a","token":"kernel_len64_double_sbcc"},
  "Solutions":[ {"sol_node_type":"SOL_KERNEL_ONLY","kernel_key":{"lengths":[ 64,0 ],"precision":"double","scheme":"CS_KERNEL_STOCKHAM_BLOCK_CC","sbrc_trans":"NONE","kernelConfig":{"use_3steps":true,"half_lds":true,"dir_reg":true,"buffer_inst":false,"tpb":16,"wgs":64,"tpt":[ 4,0 ],"factors":[ 8,2,4 ]}}}
               ,{"sol_node_type":"SOL_KERNEL_ONLY","kernel_key":{"lengths":[ 64,0 ],"precision":"double","scheme":"CS_KERNEL_STOCKHAM_BLOCK_CC","sbrc_trans":"NONE","kernelConfig":{"use_3steps":true,"half_lds":true,"dir_reg":true,"buffer_inst":true,"tpb":16,"wgs":64,"tpt":[ 4,0 ],"factors":[ 4,4,2,2 ]}}}
                ]}
,{"Problem":{"arch":"gfx90a","token":"kernel_len81_double_sbcc"},
  "Solutions":[ {"sol_node_type":"SOL_KERNEL_ONLY","kernel_key":{"lengths":[ 81,0 ],"precision":"double","scheme":"CS_KERNEL_STOCKHAM_BLOCK_CC","sbrc_trans":"NONE","kernelConfig":{"use_3steps":false,"half_lds":false,"dir_reg":false,"buffer_inst":false,"tpb":21,"wgs":189,"tpt":[ 9,0 ],"factors":[ 3,9,3 ]}}}
                ]}
,{"Problem":{"arch":"gfx90a","token":"kernel_len81_single_sbcc"},
  "Solutions":[ {"sol_node_type":"SOL_KERNEL_ONLY","kernel_key":{"lengths":[ 81,0 ],"precision":"single","scheme":"CS_KERNEL_STOCKHAM_BLOCK_CC","sbrc_trans":"NONE","kernelConfig":{"use_3steps":true,"half_lds":false,"dir_reg":true,"buffer_inst":true,"tpb":21,"wgs":189,"tpt":[ 9,0 ],"factors":[ 9,3,3 ]}}}
                ]}
,{"Problem":{"arch":"gfx90a","token":"kernel_len96_double_sbcc"},
  "Solutions":[ {"sol_node_type":"SOL_KERNEL_ONLY","kernel_key":{"lengths":[ 96,0 ],"precision":"double","scheme":"CS_KERNEL_STOCKHAM_BLOCK_CC","sbrc_trans":"NONE","kernelConfig":{"use_3steps":false,"half_lds":false,"dir_reg":true,"buffer_inst":false,"tpb":16,"wgs":192,"tpt":[ 12,0 ],"factors":[ 8,3,4 ]}}}
               ,{"sol_node_type":"SOL_KERNEL_ONLY","kernel_key":{"lengths":[ 96,0 ],"precision":"double","scheme":"CS_KERNEL_STOCKHAM_BLOCK_CC","sbrc_trans":"NONE","kernelConfig":{"use_3steps":false,"half_lds":true,"dir_reg":true,"buffer_inst":true,"tpb":16,"wgs":128,"tpt":[ 8,0 ],"factors":[ 4,2,3,4 ]}}}
                ]}
,{"Problem":{"arch":"gfx90a","token":"kernel_len100_double_sbrc"},
  "Solutions":[ {"sol_node_type":"SOL_KERNEL_ONLY","kernel_key":{"lengths":[ 100,0 ],"precision":"double","scheme":"CS_KERNEL_STOCKHAM_BLOCK_RC","sbrc_trans":"TILE_ALIGNED","kernelConfig":{"use_3steps":false,"half_lds":false,"dir_reg":true,"buffer_inst":false,"tpb":20,"wgs":200,"tpt":[ 10,0 ],"factors":[ 10,5,2 ]}}}
                ]}
,{"Problem":{"arch":"gfx90a","token":"kernel_len112_double_sbrc"},
  "Solutions":[ {"sol_node_type":"SOL_KERNEL_ONLY","kernel_key":{"lengths":[ 112,0 ],"precision":"double","scheme":"CS_KERNEL_STOCKHAM_BLOCK_RC","sbrc_trans":"TILE_ALIGNED","kernelConfig":{"use_3steps":false,"half_lds":false,"dir_reg":true,"buffer_inst":false,"tpb":16,"wgs":128,"tpt":[ 8,0 ],"factors":[ 7,2,8 ]}}}
               ,{"sol_node_type":"SOL_KERNEL_ONLY","kernel_key":{"lengths":[ 112,0 ],"precision":"double","scheme":"CS_KERNEL_STOCKHAM_BLOCK_RC","sbrc_trans":"TILE_ALIGNED","kernelConfig":{"use_3steps":false,"half_lds":true,"dir_reg":true,"buffer_inst":false,"tpb":14,"wgs":196,"tpt":[ 14,0 ],"factors":[ 8,7,2 ]}}}
               ,{"sol_node_type":"SOL_KERNEL_ONLY","kernel_key":{"lengths":[ 112,0 ],"precision":"double","scheme":"CS_KERNEL_STOCKHAM_BLOCK_RC","sbrc_trans":"TILE_ALIGNED","kernelConfig":{"use_3steps":false,"half_lds":false,"dir_reg":true,"buffer_inst":false,"tpb":16,"wgs":128,"tpt":[ 8,0 ],"factors":[ 2,4,7,2 ]}}}
                ]}
,{"Problem":{"arch":"gfx90a","token":"kernel_len125_double_sbrc"},
  "Solutions":[ {"sol_node_type":"SOL_KERNEL_ONLY","kernel_key":{"lengths":[ 125,0 ],"precision":"double","scheme":"CS_KERNEL_STOCKHAM_BLOCK_RC","sbrc_trans":"TILE_UNALIGNED","kernelConfig":{"use_3steps":false,"half_lds":true,"dir_reg":true,"buffer_inst":false,"tpb":10,"wgs":250,"tpt":[ 25,0 ],"factors":[ 5,5,5 ]}}}
               ,{"sol_node_type":"SOL_KERNEL_ONLY","kernel_key":{"lengths":[ 125,0 ],"precision":"double","scheme":"CS_KERNEL_STOCKHAM_BLOCK_RC","sbrc_trans":"TILE_UNALIGNED","kernelConfig":{"use_3steps":false,"half_lds":false,"dir_reg":true,"buffer_inst":false,"tpb":10,"wgs":250,"tpt":[ 25,0 ],"factors":[ 5,5,5 ]}}}
                ]}
,{"Problem":{"arch":"gfx90a","token":"kernel_len128_double_sbrc"},
  "Solutions":[ {"sol_node_type":"SOL_KERNEL_ONLY","kernel_key":{"lengths":[ 128,0 ],"precision":"double","scheme":"CS_KERNEL_STOCKHAM_BLOCK_RC","sbrc_trans":"TILE_ALIGNED","kernelConfig":{"use_3steps":false,"half_lds":true,"dir_reg":true,"buffer_inst":false,"tpb":16,"wgs":128,"tpt":[ 8,0 ],"factors":[ 8,2,8 ]}}}
               ,{"sol_node_type":"SOL_KERNEL_ONLY","kernel_key":{"lengths":[ 128,0 ],"precision":"double","scheme":"CS_KERNEL_STOCKHAM_BLOCK_RC","sbrc_trans":"TILE_ALIGNED","kernelConfig":{"use_3steps":false,"half_lds":false,"dir_reg":true,"buffer_inst":false,"tpb":8,"wgs":128,"tpt":[ 16,0 ],"factors":[ 8,8,2 ]}}}
                ]}
,{"Problem":{"arch":"gfx90a","token":"kernel_len192_double_sbrc"},
  "Solutions":[ {"sol_node_type":"SOL_KERNEL_ONLY","kernel_key":{"lengths":[ 192,0 ],"precision":"double","scheme":"CS_KERNEL_STOCKHAM_BLOCK_RC","sbrc_trans":"TILE_ALIGNED","kernelConfig":{"use_3steps":false,"half_lds":false,"dir_reg":true,"buffer_inst":false,"tpb":4,"wgs":64,"tpt":[ 16,0 ],"factors":[ 2,8,6,2 ]}}}
               ,{"sol_node_type":"SOL_KERNEL_ONLY","kernel_key":{"lengths":[ 192,0 ],"precision":"double","scheme":"CS_KERNEL_STOCKHAM_BLOCK_RC","sbrc_trans":"TILE_ALIGNED","kernelConfig":{"use_3steps":false,"half_lds":false,"dir_reg":true,"buffer_inst":false,"tpb":8,"wgs":128,"tpt":[ 16,0 ],"factors":[ 8,4,3,2 ]}}}
               ,{"sol_node_type":"SOL_KERNEL_ONLY","kernel_key":{"lengths":[ 192,0 ],"precision":"double","scheme":"CS_KERNEL_STOCKHAM_BLOCK_RC","sbrc_trans":"TILE_ALIGNED","kernelConfig":{"use_3steps":false,"half_lds":false,"dir_reg":true,"buffer_inst":false,"tpb":8,"wgs":192,"tpt":[ 24,0 ],"factors":[ 8,3,8 ]}}}
                ]}
,{"Problem":{"arch":"gfx90a","token":"kernel_len256_double_sbrc"},
  "Solutions":[ {"sol_node_type":"SOL_KERNEL_ONLY","kernel_key":{"lengths":[ 256,0 ],"precision":"double","scheme":"CS_KERNEL_STOCKHAM_BLOCK_RC","sbrc_trans":"TILE_ALIGNED","kernelConfig":{"use_3steps":false,"half_lds":false,"dir_reg":true,"buffer_inst":false,"tpb":8,"wgs":256,"tpt":[ 32,0 ],"factors":[ 8,4,4,2 ]}}}
                ]}
,{"Problem":{"arch":"gfx90a","token":"kernel_len49_double_sbrc"},
  "Solutions":[ {"sol_node_type":"SOL_KERNEL_ONLY","kernel_key":{"lengths":[ 49,0 ],"precision":"double","scheme":"CS_KERNEL_STOCKHAM_BLOCK_RC","sbrc_trans":"TILE_UNALIGNED","kernelConfig":{"use_3steps":false,"half_lds":false,"dir_reg":false,"buffer_inst":false,"tpb":28,"wgs":196,"tpt":[ 7,0 ],"factors":[ 7,7 ]}}}
                ]}
,{"Problem":{"arch":"gfx90a","token":"kernel_len81_double_sbrc"},
  "Solutions":[ {"sol_node_type":"SOL_KERNEL_ONLY","kernel_key":{"lengths":[ 81,0 ],"precision":"double","scheme":"CS_KERNEL_STOCKHAM_BLOCK_RC","sbrc_trans":"TILE_UNALIGNED","kernelConfig":{"use_3steps":false,"half_lds":false,"dir_reg":true,"buffer_inst":false,"tpb":22,"wgs":198,"tpt":[ 9,0 ],"factors":[ 9,3,3 ]}}}
                ]}
,{"Problem":{"arch":"gfx90a","token":"kernel_len81_single_sbrc"},
  "Solutions":[ {"sol_node_type":"SOL_KERNEL_ONLY","kernel_key":{"lengths":[ 81,0 ],"precision":"single","scheme":"CS_KERNEL_STOCKHAM_BLOCK_RC","sbrc_trans":"TILE_UNALIGNED","kernelConfig":{"use_3steps":false,"half_lds":true,"dir_reg":true,"buffer_inst":false,"tpb":36,"wgs":324,"tpt":[ 9,0 ],"factors":[ 9,3,3 ]}}}
               ,{"sol_node_type":"SOL_KERNEL_ONLY","kernel_key":{"lengths":[ 81,0 ],"precision":"single","scheme":"CS_KERNEL_STOCKHAM_BLOCK_RC","sbrc_trans":"TILE_UNALIGNED","kernelConfig":{"use_3steps":false,"half_lds":false,"dir_reg":false,"buffer_inst":false,"tpb":36,"wgs":324,"tpt":[ 9,0 ],"factors":[ 9,3,3 ]}}}
               ,{"sol_node_type":"SOL_KERNEL_ONLY","kernel_key":{"lengths":[ 81,0 ],"precision":"single","scheme":"CS_KERNEL_STOCKHAM_BLOCK_RC","sbrc_trans":"TILE_UNALIGNED","kernelConfig":{"use_3steps":false,"half_lds":true,"dir_reg":true,"buffer_inst":false,"tpb":36,"wgs":324,"tpt":[ 9,0 ],"factors":[ 3,9,3 ]}}}
               ,{"sol_node_type":"SOL_KERNEL_ONLY","kernel_key":{"lengths":[ 81,0 ],"precision":"single","scheme":"CS_KERNEL_STOCKHAM_BLOCK_RC","sbrc_trans":"TILE_UNALIGNED","kernelConfig":{"use_3steps":false,"half_lds":false,"dir_reg":true,"buffer_inst":false,"tpb":36,"wgs":324,"tpt":[ 9,0 ],"factors":[ 9,3,3 ]}}}
                ]}
,{"Problem":{"arch":"gfx90a","token":"kernel_len336_double_sbcr"},
  "Solutions":[ {"sol_node_type":"SOL_KERNEL_ONLY","kernel_key":{"lengths":[ 336,0 ],"precision":"double","scheme":"CS_KERNEL_STOCKHAM_BLOCK_CR","sbrc_trans":"NONE","kernelConfig":{"use_3steps":false,"half_lds":true,"dir_reg":true,"buffer_inst":true,"tpb":6,"wgs":252,"tpt":[ 42,0 ],"factors":[ 6,4,2,7 ]}}}
                ]}
,{"Problem":{"arch":"gfx90a","token":"kernel_len56_double_sbcr"},
  "Solutions":[ {"sol_node_type":"SOL_KERNEL_ONLY","kernel_key":{"lengths":[ 56,0 ],"precision":"double","scheme":"CS_KERNEL_STOCKHAM_BLOCK_CR","sbrc_trans":"NONE","kernelConfig":{"use_3steps":false,"half_lds":true,"dir_reg":true,"buffer_inst":false,"tpb":32,"wgs":256,"tpt":[ 8,0 ],"factors":[ 2,7,4 ]}}}
                ]}
,{"Problem":{"arch":"gfx90a","token":"kernel_len256_single_sbrc_xy_z"},
  "Solutions":[ {"sol_node_type":"SOL_KERNEL_ONLY","kernel_key":{"lengths":[ 256,0 ],"precision":"single","scheme":"CS_KERNEL_STOCKHAM_TRANSPOSE_XY_Z","sbrc_trans":"TILE_ALIGNED","kernelConfig":{"use_3steps":false,"half_lds":false,"dir_reg":true,"buffer_inst":false,"tpb":16,"wgs":256,"tpt":[ 16,0 ],"factors":[ 4,2,2,16 ]}}}
               ,{"sol_node_type":"SOL_KERNEL_ONLY","kernel_key":{"lengths":[ 256,0 ],"precision":"single","scheme":"CS_KERNEL_STOCKHAM_TRANSPOSE_XY_Z","sbrc_trans":"TILE_ALIGNED","kernelConfig":{"use_3steps":false,"half_lds":false,"dir_reg":true,"buffer_inst":false,"tpb":16,"wgs":256,"tpt":[ 16,0 ],"factors":[ 8,2,16 ]}}}
                ]}
,{"Problem":{"arch":"gfx90a","token":"125_sp_ip_complex"},
  "Solutions":[ {"sol_node_type":"SOL_DUMMY","using_scheme":"CS_NONE","solution_childnodes":[  ]}
               ,{"sol_node_type":"SOL_LEAF_NODE","using_scheme":"CS_KERNEL_STOCKHAM","solution_childnodes":[ {"child_token":"kernel_len125_single_sbrr","child_option":0} ]}
               ,{"sol_node_type":"SOL_LEAF_NODE","using_scheme":"CS_KERNEL_STOCKHAM","solution_childnodes":[ {"child_token":"kernel_len125_single_sbrr","child_option":1} ]}
                ]}
,{"Problem":{"arch":"gfx90a","token":"2187_sp_ip_complex"},
  "Solutions":[ {"sol_node_type":"SOL_DUMMY","using_scheme":"CS_NONE","solution_childnodes":[  ]}
               ,{"sol_node_type":"SOL_LEAF_NODE","using_scheme":"CS_KERNEL_STOCKHAM","solution_childnodes":[ {"child_token":"kernel_len2187_single_sbrr","child_option":0} ]}
                ]}
,{"Problem":{"arch":"gfx90a","token":"243_sp_ip_complex"},
  "Solutions":[ {"sol_node_type":"SOL_DUMMY","using_scheme":"CS_NONE","solution_childnodes":[  ]}
               ,{"sol_node_type":"SOL_LEAF_NODE","using_scheme":"CS_KERNEL_STOCKHAM","solution_childnodes":[ {"child_token":"kernel_len243_single_sbrr","child_option":0} ]}
               ,{"sol_node_type":"SOL_LEAF_NODE","using_scheme":"CS_KERNEL_STOCKHAM","solution_childnodes":[ {"child_token":"kernel_len243_single_sbrr","child_option":1} ]}
                ]}
,{"Problem":{"arch":"gfx90a","token":"256_sp_ip_complex"},
  "Solutions":[ {"sol_node_type":"SOL_DUMMY","using_scheme":"CS_NONE","solution_childnodes":[  ]}
               ,{"sol_node_type":"SOL_LEAF_NODE","using_scheme":"CS_KERNEL_STOCKHAM","solution_childnodes":[ {"child_token":"kernel_len256_single_sbrr","child_option":0} ]}
                ]}
,{"Problem":{"arch":"gfx90a","token":"4096_sp_ip_complex"},
  "Solutions":[ {"sol_node_type":"SOL_DUMMY","using_scheme":"CS_NONE","solution_childnodes":[  ]}
               ,{"sol_node_type":"SOL_LEAF_NODE","using_scheme":"CS_KERNEL_STOCKHAM","solution_childnodes":[ {"child_token":"kernel_len4096_single_sbrr","child_option":0} ]}
                ]}
,{"Problem":{"arch":"gfx90a","token":"56_dp_ip_complex"},
  "Solutions":[ {"sol_node_type":"SOL_DUMMY","using_scheme":"CS_NONE","solution_childnodes":[  ]}
               ,{"sol_node_type":"SOL_LEAF_NODE","using_scheme":"CS_KERNEL_STOCKHAM","solution_childnodes":[ {"child_token":"kernel_len56_double_sbrr","child_option":0} ]}
               ,{"sol_node_type":"SOL_LEAF_NODE","using_scheme":"CS_KERNEL_STOCKHAM","solution_childnodes":[ {"child_token":"kernel_len56_double_sbrr","child_option":1} ]}
               ,{"sol_node_type":"SOL_LEAF_NODE","using_scheme":"CS_KERNEL_STOCKHAM","solution_childnodes":[ {"child_token":"kernel_len56_double_sbrr","child_option":2} ]}
                ]}
,{"Problem":{"arch":"gfx90a","token":"81_dp_ip_complex"},
  "Solutions":[ {"sol_node_type":"SOL_DUMMY","using_scheme":"CS_NONE","solution_childnodes":[  ]}
               ,{"sol_node_type":"SOL_LEAF_NODE","using_scheme":"CS_KERNEL_STOCKHAM","solution_childnodes":[ {"child_token":"kernel_len81_double_sbrr","child_option":0} ]}
                ]}
,{"Problem":{"arch":"gfx90a","token":"sbcc_100_dp_ip_complex"},
  "Solutions":[ {"sol_node_type":"SOL_LEAF_NODE","using_scheme":"CS_KERNEL_STOCKHAM_BLOCK_CC","solution_childnodes":[ {"child_token":"kernel_len100_double_sbcc","child_option":0} ]}
                ]}
,{"Problem":{"arch":"gfx90a","token":"sbcc_125_dp_ip_complex"},
  "Solutions":[ {"sol_node_type":"SOL_LEAF_NODE","using_scheme":"CS_KERNEL_STOCKHAM_BLOCK_CC","solution_childnodes":[ {"child_token":"kernel_len125_double_sbcc","child_option":0} ]}
               ,{"sol_node_type":"SOL_LEAF_NODE","using_scheme":"CS_KERNEL_STOCKHAM_BLOCK_CC","solution_childnodes":[ {"child_token":"kernel_len125_double_sbcc","child_option":1} ]}
                ]}
,{"Problem":{"arch":"gfx90a","token":"sbcc_125_sp_ip_complex"},
  "Solutions":[ {"sol_node_type":"SOL_LEAF_NODE","using_scheme":"CS_KERNEL_STOCKHAM_BLOCK_CC","solution_childnodes":[ {"child_token":"kernel_len125_single_sbcc","child_option":0} ]}
               ,{"sol_node_type":"SOL_LEAF_NODE","using_scheme":"CS_KERNEL_STOCKHAM_BLOCK_CC","solution_childnodes":[ {"child_token":"kernel_len125_single_sbcc","child_option":1} ]}
               ,{"sol_node_type":"SOL_LEAF_NODE","using_scheme":"CS_KERNEL_STOCKHAM_BLOCK_CC","solution_childnodes":[ {"child_token":"kernel_len125_single_sbcc","child_option":2} ]}
                ]}
,{"Problem":{"arch":"gfx90a","token":"sbcc_168_dp_ip_complex"},
  "Solutions":[ {"sol_node_type":"SOL_LEAF_NODE","using_scheme":"CS_KERNEL_STOCKHAM_BLOCK_CC","solution_childnodes":[ {"child_token":"kernel_len168_double_sbcc","child_option":0} ]}
               ,{"sol_node_type":"SOL_LEAF_NODE","using_scheme":"CS_KERNEL_STOCKHAM_BLOCK_CC","solution_childnodes":[ {"child_token":"kernel_len168_double_sbcc","child_option":1} ]}
               ,{"sol_node_type":"SOL_LEAF_NODE","using_scheme":"CS_KERNEL_STOCKHAM_BLOCK_CC","solution_childnodes":[ {"child_token":"kernel_len168_double_sbcc","child_option":2} ]}
                ]}
,{"Problem":{"arch":"gfx90a","token":"sbcc_224_dp_ip_complex"},
  "Solutions":[ {"sol_node_type":"SOL_LEAF_NODE","using_scheme":"CS_KERNEL_STOCKHAM_BLOCK_CC","solution_childnodes":[ {"child_token":"kernel_len224_double_sbcc","child_option":0} ]}
                ]}
,{"Problem":{"arch":"gfx90a","token":"sbcc_243_dp_ip_complex"},
  "Solutions":[ {"sol_node_type":"SOL_LEAF_NODE","using_scheme":"CS_KERNEL_STOCKHAM_BLOCK_CC","solution_childnodes":[ {"child_token":"kernel_len243_double_sbcc","child_option":0} ]}
               ,{"sol_node_type":"SOL_LEAF_NODE","using_scheme":"CS_KERNEL_STOCKHAM_BLOCK_CC","solution_childnodes":[ {"child_token":"kernel_len243_double_sbcc","child_option":1} ]}
               ,{"sol_node_type":"SOL_LEAF_NODE","using_scheme":"CS_KERNEL_STOCKHAM_BLOCK_CC","solution_childnodes":[ {"child_token":"kernel_len243_double_sbcc","child_option":2} ]}
                ]}
,{"Problem":{"arch":"gfx90a","token":"sbcc_243_sp_ip_complex"},
  "Solutions":[ {"sol_node_type":"SOL_LEAF_NODE","using_scheme":"CS_KERNEL_STOCKHAM_BLOCK_CC","solution_childnodes":[ {"child_token":"kernel_len243_single_sbcc","child_option":0} ]}
                ]}
,{"Problem":{"arch":"gfx90a","token":"sbcc_336_dp_ip_complex"},
  "Solutions":[ {"sol_node_type":"SOL_LEAF_NODE","using_scheme":"CS_KERNEL_STOCKHAM_BLOCK_CC","solution_childnodes":[ {"child_token":"kernel_len336_double_sbcc","child_option":0} ]}
               ,{"sol_node_type":"SOL_LEAF_NODE","using_scheme":"CS_KERNEL_STOCKHAM_BLOCK_CC","solution_childnodes":[ {"child_token":"kernel_len336_double_sbcc","child_option":1} ]}
               ,{"sol_node_type":"SOL_LEAF_NODE","using_scheme":"CS_KERNEL_STOCKHAM_BLOCK_CC","solution_childnodes":[ {"child_token":"kernel_len336_double_sbcc","child_option":2} ]}
               ,{"sol_node_type":"SOL_LEAF_NODE","using_scheme":"CS_KERNEL_STOCKHAM_BLOCK_CC","solution_childnodes":[ {"child_token":"kernel_len336_double_sbcc","child_option":3} ]}
               ,{"sol_node_type":"SOL_LEAF_NODE","using_scheme":"CS_KERNEL_STOCKHAM_BLOCK_CC","solution_childnodes":[ {"child_token":"kernel_len336_double_sbcc","child_option":4} ]}
                ]}
,{"Problem":{"arch":"gfx90a","token":"sbcc_343_dp_ip_complex"},
  "Solutions":[ {"sol_node_type":"SOL_LEAF_NODE","using_scheme":"CS_KERNEL_STOCKHAM_BLOCK_CC","solution_childnodes":[ {"child_token":"kernel_len343_double_sbcc","child_option":0} ]}
                ]}
,{"Problem":{"arch":"gfx90a","token":"sbcc_64_dp_ip_complex"},
  "Solutions":[ {"sol_node_type":"SOL_LEAF_NODE","using_scheme":"CS_KERNEL_STOCKHAM_BLOCK_CC","solution_childnodes":[ {"child_token":"kernel_len64_double_sbcc","child_option":0} ]}
               ,{"sol_node_type":"SOL_LEAF_NODE","using_scheme":"CS_KERNEL_STOCKHAM_BLOCK_CC","solution_childnodes":[ {"child_token":"kernel_len64_double_sbcc","child_option":1} ]}
                ]}
,{"Problem":{"arch":"gfx90a","token":"sbcc_81_dp_ip_complex"},
  "Solutions":[ {"sol_node_type":"SOL_LEAF_NODE","using_scheme":"CS_KERNEL_STOCKHAM_BLOCK_CC","solution_childnodes":[ {"child_token":"kernel_len81_double_sbcc","child_option":0} ]}
                ]}
,{"Problem":{"arch":"gfx90a","token":"sbcc_81_sp_ip_complex"},
  "Solutions":[ {"sol_node_type":"SOL_LEAF_NODE","using_scheme":"CS_KERNEL_STOCKHAM_BLOCK_CC","solution_childnodes":[ {"child_token":"kernel_len81_single_sbcc","child_option":0} ]}
                ]}
,{"Problem":{"arch":"gfx90a","token":"sbcc_96_dp_ip_complex"},
  "Solutions":[ {"sol_node_type":"SOL_LEAF_NODE","using_scheme":"CS_KERNEL_STOCKHAM_BLOCK_CC","solution_childnodes":[ {"child_token":"kernel_len96_double_sbcc","child_option":0} ]}
               ,{"sol_node_type":"SOL_LEAF_NODE","using_scheme":"CS_KERNEL_STOCKHAM_BLOCK_CC","solution_childnodes":[ {"child_token":"kernel_len96_double_sbcc","child_option":1} ]}
                ]}
,{"Problem":{"arch":"gfx90a","token":"sbrc_100_dp_ip_complex"},
  "Solutions":[ {"sol_node_type":"SOL_LEAF_NODE","using_scheme":"CS_KERNEL_STOCKHAM_BLOCK_RC","solution_childnodes":[ {"child_token":"kernel_len100_double_sbrc","child_option":0} ]}
                ]}
,{"Problem":{"arch":"gfx90a","token":"sbrc_112_dp_ip_complex"},
  "Solutions":[ {"sol_node_type":"SOL_LEAF_NODE","using_scheme":"CS_KERNEL_STOCKHAM_BLOCK_RC","solution_childnodes":[ {"child_token":"kernel_len112_double_sbrc","child_option":0} ]}
               ,{"sol_node_type":"SOL_LEAF_NODE","using_scheme":"CS_KERNEL_STOCKHAM_BLOCK_RC","solution_childnodes":[ {"child_token":"kernel_len112_double_sbrc","child_option":1} ]}
               ,{"sol_node_type":"SOL_LEAF_NODE","using_scheme":"CS_KERNEL_STOCKHAM_BLOCK_RC","solution_childnodes":[ {"child_token":"kernel_len112_double_sbrc","child_option":2} ]}
                ]}
,{"Problem":{"arch":"gfx90a","token":"sbrc_125_dp_ip_complex"},
  "Solutions":[ {"sol_node_type":"SOL_LEAF_NODE","using_scheme":"CS_KERNEL_STOCKHAM_BLOCK_RC","solution_childnodes":[ {"child_token":"kernel_len125_double_sbrc","child_option":0} ]}
               ,{"sol_node_type":"SOL_LEAF_NODE","using_scheme":"CS_KERNEL_STOCKHAM_BLOCK_RC","solution_childnodes":[ {"child_token":"kernel_len125_double_sbrc","child_option":1} ]}
                ]}
,{"Problem":{"arch":"gfx90a","token":"sbrc_128_dp_ip_complex"},
  "Solutions":[ {"sol_node_type":"SOL_LEAF_NODE","using_scheme":"CS_KERNEL_STOCKHAM_BLOCK_RC","solution_childnodes":[ {"child_token":"kernel_len128_double_sbrc","child_option":0} ]}
               ,{"sol_node_type":"SOL_LEAF_NODE","using_scheme":"CS_KERNEL_STOCKHAM_BLOCK_RC","solution_childnodes":[ {"child_token":"kernel_len128_double_sbrc","child_option":1} ]}
                ]}
,{"Problem":{"arch":"gfx90a","token":"sbrc_192_dp_ip_complex"},
  "Solutions":[ {"sol_node_type":"SOL_LEAF_NODE","using_scheme":"CS_KERNEL_STOCKHAM_BLOCK_RC","solution_childnodes":[ {"child_token":"kernel_len192_double_sbrc","child_option":0} ]}
               ,{"sol_node_type":"SOL_LEAF_NODE","using_scheme":"CS_KERNEL_STOCKHAM_BLOCK_RC","solution_childnodes":[ {"child_token":"kernel_len192_double_sbrc","child_option":1} ]}
               ,{"sol_node_type":"SOL_LEAF_NODE","using_scheme":"CS_KERNEL_STOCKHAM_BLOCK_RC","solution_childnodes":[ {"child_token":"kernel_len192_double_sbrc","child_option":2} ]}
                ]}
,{"Problem":{"arch":"gfx90a","token":"sbrc_256_dp_ip_complex"},
  "Solutions":[ {"sol_node_type":"SOL_LEAF_NODE","using_scheme":"CS_KERNEL_STOCKHAM_BLOCK_RC","solution_childnodes":[ {"child_token":"kernel_len256_double_sbrc","child_option":0} ]}
                ]}
,{"Problem":{"arch":"gfx90a","token":"sbrc_49_dp_ip_complex"},
  "Solutions":[ {"sol_node_type":"SOL_LEAF_NODE","using_scheme":"CS_KERNEL_STOCKHAM_BLOCK_RC","solution_childnodes":[ {"child_token":"kernel_len49_double_sbrc","child_option":0} ]}
                ]}
,{"Problem":{"arch":"gfx90a","token":"sbrc_81_dp_ip_complex"},
  "Solutions":[ {"sol_node_type":"SOL_LEAF_NODE","using_scheme":"CS_KERNEL_STOCKHAM_BLOCK_RC","solution_childnodes":[ {"child_token":"kernel_len81_double_sbrc","child_option":0} ]}
                ]}
,{"Problem":{"arch":"gfx90a","token":"sbrc_81_sp_ip_complex"},
  "Solutions":[ {"sol_node_type":"SOL_LEAF_NODE","using_scheme":"CS_KERNEL_STOCKHAM_BLOCK_RC","solution_childnodes":[ {"child_token":"kernel_len81_single_sbrc","child_option":0} ]}
               ,{"sol_node_type":"SOL_LEAF_NODE","using_scheme":"CS_KERNEL_STOCKHAM_BLOCK_RC","solution_childnodes":[ {"child_token":"kernel_len81_single_sbrc","child_option":1} ]}
               ,{"sol_node_type":"SOL_LEAF_NODE","using_scheme":"CS_KERNEL_STOCKHAM_BLOCK_RC","solution_childnodes":[ {"child_token":"kernel_len81_single_sbrc","child_option":2} ]}
               ,{"sol_node_type":"SOL_LEAF_NODE","using_scheme":"CS_KERNEL_STOCKHAM_BLOCK_RC","solution_childnodes":[ {"child_token":"kernel_len81_single_sbrc","child_option":3} ]}
                ]}
,{"Problem":{"arch":"gfx90a","token":"sbcr_336_dp_ip_complex"},
  "Solutions":[ {"sol_node_type":"SOL_LEAF_NODE","using_scheme":"CS_KERNEL_STOCKHAM_BLOCK_CR","solution_childnodes":[ {"child_token":"kernel_len336_double_sbcr","child_option":0} ]}
                ]}
,{"Problem":{"arch":"gfx90a","token":"sbcr_56_dp_ip_complex"},
  "Solutions":[ {"sol_node_type":"SOL_LEAF_NODE","using_scheme":"CS_KERNEL_STOCKHAM_BLOCK_CR","solution_childnodes":[ {"child_token":"kernel_len56_double_sbcr","child_option":0} ]}
                ]}
,{"Problem":{"arch":"gfx90a","token":"leafnode_token_builtin_kernel"},
  "Solutions":[ {"sol_node_type":"SOL_LEAF_NODE","using_scheme":"CS_KERNEL_TRANSPOSE","solution_childnodes":[ {"child_token":"kernel_token_builtin_kernel","child_option":0} ]}
               ,{"sol_node_type":"SOL_LEAF_NODE","using_scheme":"CS_KERNEL_TRANSPOSE_XY_Z","solution_childnodes":[ {"child_token":"kernel_token_builtin_kernel","child_option":0} ]}
               ,{"sol_node_type":"SOL_LEAF_NODE","using_scheme":"CS_KERNEL_TRANSPOSE_Z_XY","solution_childnodes":[ {"child_token":"kernel_token_builtin_kernel","child_option":0} ]}
                ]}
,{"Problem":{"arch":"gfx90a","token":"sbrc_xy_z_256_sp_ip_complex"},
  "Solutions":[ {"sol_node_type":"SOL_LEAF_NODE","using_scheme":"CS_KERNEL_STOCKHAM_TRANSPOSE_XY_Z","solution_childnodes":[ {"child_token":"kernel_len256_single_sbrc_xy_z","child_option":0} ]}
               ,{"sol_node_type":"SOL_LEAF_NODE","using_scheme":"CS_KERNEL_STOCKHAM_TRANSPOSE_XY_Z","solution_childnodes":[ {"child_token":"kernel_len256_single_sbrc_xy_z","child_option":1} ]}
                ]}
,{"Problem":{"arch":"gfx90a","token":"14348907_sp_ip_complex"},
  "Solutions":[ {"sol_node_type":"SOL_INTERNAL_NODE","using_scheme":"CS_L1D_TRTRT","solution_childnodes":[ {"child_token":"leafnode_token_builtin_kernel","child_option":0},{"child_token":"6561_sp_ip_complex","child_option":1},{"child_token":"leafnode_token_builtin_kernel","child_option":0},{"child_token":"2187_sp_ip_complex","child_option":1},{"child_token":"leafnode_token_builtin_kernel","child_option":0} ]}
                ]}
,{"Problem":{"arch":"gfx90a","token":"16777216_sp_ip_complex"},
  "Solutions":[ {"sol_node_type":"SOL_INTERNAL_NODE","using_scheme":"CS_L1D_TRTRT","solution_childnodes":[ {"child_token":"leafnode_token_builtin_kernel","child_option":0},{"child_token":"4096_sp_ip_complex","child_option":1},{"child_token":"leafnode_token_builtin_kernel","child_option":0},{"child_token":"4096_sp_ip_complex","child_option":1},{"child_token":"leafnode_token_builtin_kernel","child_option":0} ]}
                ]}
,{"Problem":{"arch":"gfx90a","token":"10000_dp_op_complex"},
  "Solutions":[ {"sol_node_type":"SOL_INTERNAL_NODE","using_scheme":"CS_L1D_CC","solution_childnodes":[ {"child_token":"sbcc_100_dp_ip_complex","child_option":0},{"child_token":"sbrc_100_dp_ip_complex","child_option":0} ]}
                ]}
,{"Problem":{"arch":"gfx90a","token":"10752_dp_op_complex"},
  "Solutions":[ {"sol_node_type":"SOL_INTERNAL_NODE","using_scheme":"CS_L1D_CC","solution_childnodes":[ {"child_token":"sbcc_96_dp_ip_complex","child_option":1},{"child_token":"sbrc_112_dp_ip_complex","child_option":2} ]}
                ]}
,{"Problem":{"arch":"gfx90a","token":"15625_dp_op_complex"},
  "Solutions":[ {"sol_node_type":"SOL_INTERNAL_NODE","using_scheme":"CS_L1D_CC","solution_childnodes":[ {"child_token":"sbcc_125_dp_ip_complex","child_option":1},{"child_token":"sbrc_125_dp_ip_complex","child_option":1} ]}
                ]}
,{"Problem":{"arch":"gfx90a","token":"16384_dp_op_complex"},
  "Solutions":[ {"sol_node_type":"SOL_INTERNAL_NODE","using_scheme":"CS_L1D_CC","solution_childnodes":[ {"child_token":"sbcc_64_dp_ip_complex","child_option":1},{"child_token":"sbrc_256_dp_ip_complex","child_option":0} ]}
                ]}
,{"Problem":{"arch":"gfx90a","token":"16807_dp_op_complex"},
  "Solutions":[ {"sol_node_type":"SOL_INTERNAL_NODE","using_scheme":"CS_L1D_CC","solution_childnodes":[ {"child_token":"sbcc_343_dp_ip_complex","child_option":0},{"child_token":"sbrc_49_dp_ip_complex","child_option":0} ]}
                ]}
,{"Problem":{"arch":"gfx90a","token":"18816_dp_op_complex"},
  "Solutions":[ {"sol_node_type":"SOL_INTERNAL_NODE","using_scheme":"CS_L1D_CC","solution_childnodes":[ {"child_token":"sbcc_168_dp_ip_complex","child_option":0},{"child_token":"sbrc_112_dp_ip_complex","child_option":1} ]}
                ]}
,{"Problem":{"arch":"gfx90a","token":"21504_dp_op_complex"},
  "Solutions":[ {"sol_node_type":"SOL_INTERNAL_NODE","using_scheme":"CS_L1D_CC","solution_childnodes":[ {"child_token":"sbcc_168_dp_ip_complex","child_option":0},{"child_token":"sbrc_128_dp_ip_complex","child_option":1} ]}
                ]}
,{"Problem":{"arch":"gfx90a","token":"32256_dp_op_complex"},
  "Solutions":[ {"sol_node_type":"SOL_INTERNAL_NODE","using_scheme":"CS_L1D_CC","solution_childnodes":[ {"child_token":"sbcc_168_dp_ip_complex","child_option":2},{"child_token":"sbrc_192_dp_ip_complex","child_option":0} ]}
                ]}
,{"Problem":{"arch":"gfx90a","token":"43008_dp_op_complex"},
  "Solutions":[ {"sol_node_type":"SOL_INTERNAL_NODE","using_scheme":"CS_L1D_CC","solution_childnodes":[ {"child_token":"sbcc_224_dp_ip_complex","child_option":0},{"child_token":"sbrc_192_dp_ip_complex","child_option":2} ]}
                ]}
,{"Problem":{"arch":"gfx90a","token":"6561_sp_ip_complex"},
  "Solutions":[ {"sol_node_type":"SOL_DUMMY","using_scheme":"CS_NONE","solution_childnodes":[  ]}
               ,{"sol_node_type":"SOL_INTERNAL_NODE","using_scheme":"CS_L1D_CC","solution_childnodes":[ {"child_token":"sbcc_81_sp_ip_complex","child_option":0},{"child_token":"sbrc_81_sp_ip_complex","child_option":0} ]}
               ,{"sol_node_type":"SOL_INTERNAL_NODE","using_scheme":"CS_L1D_CC","solution_childnodes":[ {"child_token":"sbcc_81_sp_ip_complex","child_option":0},{"child_token":"sbrc_81_sp_ip_complex","child_option":1} ]}
               ,{"sol_node_type":"SOL_INTERNAL_NODE","using_scheme":"CS_L1D_CC","solution_childnodes":[ {"child_token":"sbcc_81_sp_ip_complex","child_option":0},{"child_token":"sbrc_81_sp_ip_complex","child_option":2} ]}
               ,{"sol_node_type":"SOL_INTERNAL_NODE","using_scheme":"CS_L1D_CC","solution_childnodes":[ {"child_token":"sbcc_81_sp_ip_complex","child_option":0},{"child_token":"sbrc_81_sp_ip_complex","child_option":3} ]}
                ]}
,{"Problem":{"arch":"gfx90a","token":"8192_dp_op_complex"},
  "Solutions":[ {"sol_node_type":"SOL_INTERNAL_NODE","using_scheme":"CS_L1D_CC","solution_childnodes":[ {"child_token":"sbcc_64_dp_ip_complex","child_option":0},{"child_token":"sbrc_128_dp_ip_complex","child_option":0} ]}
                ]}
,{"Problem":{"arch":"gfx90a","token":"4096_4096_sp_ip_complex"},
  "Solutions":[ {"sol_node_type":"SOL_INTERNAL_NODE","using_scheme":"CS_2D_RTRT","solution_childnodes":[ {"child_token":"4096_sp_ip_complex","child_option":1},{"child_token":"leafnode_token_builtin_kernel","child_option":0},{"child_token":"4096_sp_ip_complex","child_option":1},{"child_token":"leafnode_token_builtin_kernel","child_option":0} ]}
                ]}
,{"Problem":{"arch":"gfx90a","token":"6561_6561_sp_ip_complex"},
  "Solutions":[ {"sol_node_type":"SOL_INTERNAL_NODE","using_scheme":"CS_2D_RTRT","solution_childnodes":[ {"child_token":"6561_sp_ip_complex","child_option":4},{"child_token":"leafnode_token_builtin_kernel","child_option":0},{"child_token":"6561_sp_ip_complex","child_option":1},{"child_token":"leafnode_token_builtin_kernel","child_option":0} ]}
                ]}
,{"Problem":{"arch":"gfx90a","token":"125_125_sp_ip_complex"},
  "Solutions":[ {"sol_node_type":"SOL_DUMMY","using_scheme":"CS_NONE","solution_childnodes":[  ]}
               ,{"sol_node_type":"SOL_INTERNAL_NODE","using_scheme":"CS_2D_RC","solution_childnodes":[ {"child_token":"125_sp_ip_complex","child_option":1},{"child_token":"sbcc_125_sp_ip_complex","child_option":0} ]}
               ,{"sol_node_type":"SOL_INTERNAL_NODE","using_scheme":"CS_2D_RC","solution_childnodes":[ {"child_token":"125_sp_ip_complex","child_option":2},{"child_token":"sbcc_125_sp_ip_complex","child_option":0} ]}
                ]}
,{"Problem":{"arch":"gfx90a","token":"243_243_sp_ip_complex"},
  "Solutions":[ {"sol_node_type":"SOL_DUMMY","using_scheme":"CS_NONE","solution_childnodes":[  ]}
               ,{"sol_node_type":"SOL_INTERNAL_NODE","using_scheme":"CS_2D_RC","solution_childnodes":[ {"child_token":"243_sp_ip_complex","child_option":1},{"child_token":"sbcc_243_sp_ip_complex","child_option":0} ]}
                ]}
,{"Problem":{"arch":"gfx90a","token":"56_336_dp_ip_complex"},
  "Solutions":[ {"sol_node_type":"SOL_DUMMY","using_scheme":"CS_NONE","solution_childnodes":[  ]}
               ,{"sol_node_type":"SOL_INTERNAL_NODE","using_scheme":"CS_2D_RC","solution_childnodes":[ {"child_token":"56_dp_ip_complex","child_option":1},{"child_token":"sbcc_336_dp_ip_complex","child_option":0} ]}
               ,{"sol_node_type":"SOL_INTERNAL_NODE","using_scheme":"CS_2D_RC","solution_childnodes":[ {"child_token":"56_dp_ip_complex","child_option":2},{"child_token":"sbcc_336_dp_ip_complex","child_option":2} ]}
               ,{"sol_node_type":"SOL_INTERNAL_NODE","using_scheme":"CS_2D_RC","solution_childnodes":[ {"child_token":"56_dp_ip_complex","child_option":3},{"child_token":"sbcc_336_dp_ip_complex","child_option":4} ]}
                ]}
,{"Problem":{"arch":"gfx90a","token":"81_81_dp_ip_complex"},
  "Solutions":[ {"sol_node_type":"SOL_DUMMY","using_scheme":"CS_NONE","solution_childnodes":[  ]}
               ,{"sol_node_type":"SOL_INTERNAL_NODE","using_scheme":"CS_2D_RC","solution_childnodes":[ {"child_token":"81_dp_ip_complex","child_option":1},{"child_token":"sbcc_81_dp_ip_complex","child_option":0} ]}
                ]}
,{"Problem":{"arch":"gfx90a","token":"81_81_dp_op_complex"},
  "Solutions":[ {"sol_node_type":"SOL_INTERNAL_NODE","using_scheme":"CS_2D_RC","solution_childnodes":[ {"child_token":"81_dp_ip_complex","child_option":1},{"child_token":"sbcc_81_dp_ip_complex","child_option":0} ]}
                ]}
,{"Problem":{"arch":"gfx90a","token":"243_243_243_sp_ip_complex"},
  "Solutions":[ {"sol_node_type":"SOL_INTERNAL_NODE","using_scheme":"CS_3D_RTRT","solution_childnodes":[ {"child_token":"243_243_sp_ip_complex","child_option":1},{"child_token":"leafnode_token_builtin_kernel","child_option":1},{"child_token":"243_sp_ip_complex","child_option":2},{"child_token":"leafnode_token_builtin_kernel","child_option":2} ]}
                ]}
,{"Problem":{"arch":"gfx90a","token":"256_256_256_sp_ip_complex"},
  "Solutions":[ {"sol_node_type":"SOL_INTERNAL_NODE","using_scheme":"CS_3D_BLOCK_RC","solution_childnodes":[ {"child_token":"sbrc_xy_z_256_sp_ip_complex","child_option":0},{"child_token":"sbrc_xy_z_256_sp_ip_complex","child_option":1},{"child_token":"256_sp_ip_complex","child_option":1},{"child_token":"leafnode_token_builtin_kernel","child_option":1} ]}
                ]}
,{"Problem":{"arch":"gfx90a","token":"56_336_336_dp_op_complex"},
  "Solutions":[ {"sol_node_type":"SOL_INTERNAL_NODE","using_scheme":"CS_3D_BLOCK_CR","solution_childnodes":[ {"child_token":"sbcr_336_dp_ip_complex","child_option":0},{"child_token":"sbcr_336_dp_ip_complex","child_option":0},{"child_token":"sbcr_56_dp_ip_complex","child_option":0} ]}
                ]}
,{"Problem":{"arch":"gfx90a","token":"125_125_125_sp_ip_complex"},
  "Solutions":[ {"sol_node_type":"SOL_INTERNAL_NODE","using_scheme":"CS_3D_RC","solution_childnodes":[ {"child_token":"125_125_sp_ip_complex","child_option":2},{"child_token":"sbcc_125_sp_ip_complex","child_option":2} ]}
                ]}
,{"Problem":{"arch":"gfx90a","token":"56_336_336_dp_ip_complex"},
  "Solutions":[ {"sol_node_type":"SOL_INTERNAL_NODE","using_scheme":"CS_3D_RC","solution_childnodes":[ {"child_token":"56_336_dp_ip_complex","child_option":3},{"child_token":"sbcc_336_dp_ip_complex","child_option":3} ]}
                ]}
,{"Problem":{"arch":"gfx90a","token":"81_81_81_dp_op_complex"},
  "Solutions":[ {"sol_node_type":"SOL_INTERNAL_NODE","using_scheme":"CS_3D_RC","solution_childnodes":[ {"child_token":"81_81_dp_ip_complex","child_option":1},{"child_token":"sbcc_81_dp_ip_complex","child_option":0} ]}
                ]}
]
